code,cpv_label,level
45112740,Travaux d'aménagement paysager d'aéroports,8
45211100,Travaux de construction de maisons,8
45211200,Travaux de construction de logements-foyers,8
45211300,Travaux de construction complète de maisons,8
45211310,Travaux de construction de salles de bains,8
45211320,Travaux de construction de porches,8
45211340,Travaux de construction d'immeubles collectifs,8
45211341,Travaux de construction d'appartements,8
45211350,Travaux de construction de bâtiments multifonctionnels,8
45211360,Travaux de développement urbain,8
45211370,Travaux de construction de saunas,8
45212100,Construction d'équipements pour les loisirs,8
45212110,Travaux de construction de centres de loisirs,8
45212120,Travaux de construction de parcs à thèmes,8
45212130,Travaux de construction de parcs d'attractions,8
45212140,Installation récréative,8
45212150,Travaux de construction de cinémas,8
45212160,Travaux de construction de casinos,8
45212170,Travaux de construction de bâtiments de loisirs,8
45212171,Travaux de construction de centres de divertissements,8
45212172,Travaux de construction de centres récréatifs,8
45212180,Travaux de construction de billetteries,8
45212190,Ouvrages de protection contre le soleil,8
45212200,Travaux de construction d'installations sportives,8
45212210,Travaux de construction d'installations sportives monovalentes,8
45212211,Travaux de construction de patinoires,8
45212212,Travaux de construction de piscines,8
45212213,Travaux de marquage sportif,8
45212220,Travaux de construction d'installations sportives polyvalentes,8
45212221,Travaux de construction d'ouvrages pour terrain de sports,8
45212222,Travaux de construction de gymnases,8
45212223,Travaux de construction d'installations de sports d'hiver,8
45212224,Travaux de construction de stades,8
45212225,Travaux de construction de palais des sports,8
45212230,Installation de vestiaires,8
45212290,Réparation et entretien d'infrastructures sportives,8
45212300,Travaux de construction de bâtiments à usage artistique et culturel,8
45212310,Travaux de construction de bâtiments destinés aux expositions,8
45212311,Travaux de construction de galeries d'art,8
45212312,Travaux de construction de parcs des expositions,8
45212313,Travaux de construction de musées,8
45212314,Travaux de construction de monuments historiques ou de mémoriaux,8
45212320,Travaux de construction de bâtiments destinés aux activités artistiques,8
45212321,Travaux de construction d'auditoriums,8
45212322,Travaux de construction de theâtres,8
45212330,Travaux de construction de bibliothèques,8
45212331,Travaux de construction de bibliothèques multimédia,8
45212340,Travaux de construction de salle de conférences,8
45212350,Bâtiments présentant un intérêt historique ou architectural particulier,8
45212351,Travaux de construction de monuments préhistoriques,8
45212352,Travaux de construction de monuments industriels,8
45212353,Travaux de construction de palais,8
45212354,Travaux de construction de châteaux,8
45212360,Travaux de construction de bâtiments religieux,8
45212361,Travaux de construction d'églises,8
45212400,Hôtels et restaurants,8
45212410,Travaux de construction de bâtiments destinés à l'hébergement,8
45212411,Travaux de construction d'hôtels,8
45212412,Travaux de construction de foyers,8
45212413,Travaux de construction de logements pour séjours de courte durée,8
45212420,Travaux de construction de restaurants et d'établissements similaires,8
45212421,Travaux de construction de restaurants,8
45212422,Travaux de construction de cantines,8
45212423,Travaux de construction de cafétarias,8
45212500,Transformation de cuisines ou de restaurants,8
45212600,Travaux de construction de pavillons,8
45213100,Travaux de construction de locaux commerciaux,8
45213110,Travaux de construction de magasins,8
45213111,Travaux de construction de centres commerciaux,8
45213112,Travaux de construction de boutiques,8
45213120,Travaux de construction de bureaux de poste,8
45213130,Travaux de construction de banques,8
45213140,Travaux de construction de marchés,8
45213141,Travaux de construction de marchés couverts,8
45213142,Travaux de construction de marchés à ciel ouvert,8
45213150,Travaux de construction d'immeubles de bureaux,8
45213200,Travaux de construction d'entrepôts et de bâtiments industriels,8
45213210,Entrepôts frigorifiques,8
45213220,Travaux de construction d'entrepôts,8
45213221,Travaux de construction de dépôts,8
45213230,Travaux de construction d'abattoirs,8
45213240,Travaux de construction de bâtiments agricoles,8
45213241,Travaux de construction de granges,8
45213242,Travaux de construction d'étables,8
45213250,Travaux de construction de bâtiments industriels,8
45213251,Travaux de construction d'unités industrielles,8
45213252,Travaux de construction d'ateliers,8
45213260,Travaux de construction d'entrepôts de marchandises,8
45213270,Travaux de construction de stations de recyclage,8
45213280,Travaux de construction d'installations de compostage,8
45213300,Bâtiments liés aux activités de transport,8
45213310,Travaux de construction de bâtiments liés aux transports routiers,8
45213311,Travaux de construction de gares routières,8
45213312,Travaux de construction de parkings à étages,8
45213313,Travaux de construction de bâtiments d'aire de services,8
45213314,Travaux de construction de dépôts d'autobus,8
45213315,Travaux de construction d'abris-bus,8
45213316,Travaux d'installation de passerelles,8
45213320,Travaux de construction de bâtiments liés aux transports ferroviaires,8
45213321,Travaux de construction de gares de chemin de fer,8
45213322,Travaux de construction de terminaux ferroviaires,8
45213330,Travaux de construction de bâtiments liés aux transports aériens,8
45213331,Travaux de construction de bâtiments aéroportuaires,8
45213332,Travaux de construction de tours de contrôle d'aéroport,8
45213333,Travaux d' installation de comptoirs d'enregistrement d'aéroport,8
45213340,Travaux de construction de bâtiments liés aux transports par voie d'eau,8
45213341,Travaux de construction de terminaux de ferry,8
45213342,Travaux de construction de terminaux Ro-Ro,8
45213350,Travaux de construction de bâtiments liés à plusieurs modes de transport,8
45213351,Travaux de construction de hangars d'entretien,8
45213352,Travaux de construction de dépôts de service,8
45213353,Travaux d'installation de passerelles pour passagers,8
45213400,Installation de locaux pour le personnel,8
45214100,Travaux de construction de jardins d'enfants,8
45214200,Travaux de construction de bâtiments scolaires,8
45214210,Travaux de construction d'écoles primaires,8
45214220,Travaux de construction d'écoles secondaires,8
45214230,Travaux de construction d'écoles spécialisées,8
45214300,Construction d'établissements d'enseignement supérieur,8
45214310,Travaux de construction de collèges professionnels,8
45214320,Travaux de construction de collèges techniques,8
45214400,Construction de bâtiments universitaires,8
45214410,Travaux de construction d'instituts polytechniques,8
45214420,Travaux de construction d'amphithéâtres,8
45214430,Travaux de construction de laboratoires de langues,8
45214500,Travaux de construction de centres de formation continue,8
45214600,Construction de centres de recherche,8
45214610,Travaux de construction de bâtiments de laboratoire,8
45214620,Travaux de construction d'équipements de recherche et d'essai,8
45214630,Installations scientifiques,8
45214631,Travaux d'installation de salles blanches,8
45214640,Travaux de construction de stations météorologiques,8
45214700,Travaux de construction de cité universitaire,8
45214710,Travaux de construction de halls d'entrée,8
45214800,Construction d'équipements de formation,8
45215100,Travaux de construction de bâtiments liés à la santé,8
45215110,Travaux de construction de spas,8
45215120,Travaux de construction de bâtiments médicaux spécialisés,8
45215130,Travaux de construction de cliniques,8
45215140,Travaux de construction d'équipements hospitaliers,8
45215141,Travaux de construction de salles d'opération,8
45215142,Travaux de construction d'unités de soins intensifs,8
45215143,Travaux de construction de salles de dépistage et de diagnostic,8
45215144,Travaux de construction de salles de dépistage,8
45215145,Travaux de construction de salles de radioscopie,8
45215146,Travaux de construction de salles de pathologie,8
45215147,Travaux de construction de salles de médecine légale,8
45215148,Travaux de construction de salles de cathétérisme,8
45215200,Construction de bâtiments pour les services sociaux,8
45215210,Travaux de construction de foyers et de structures d'accueil à caractère social,8
45215212,Travaux de construction de maisons de retraite,8
45215213,Travaux de construction de centres de soins,8
45215214,Travaux de construction de foyers résidentiels,8
45215215,Travaux de construction de foyers pour enfants,8
45215220,"Travaux de construction d'établissements sociaux, excepté foyers et structures d'accueil à caractère social",8
45215221,Travaux de construction de foyers de jour,8
45215222,Travaux de construction de centres administratifs,8
45215300,Travaux de construction de crématorium,8
45215400,Cimetière,8
45215500,Toilettes publiques,8
45216100,Travaux de construction de bâtiments destinés aux institutions d'ordre public ou aux services de secours,8
45216110,Travaux de construction de bâtiments destinés aux institutions d'ordre public,8
45216111,Travaux de construction de commissariats de police,8
45216112,Travaux de construction de tribunaux,8
45216113,Travaux de construction de prisons,8
45216114,Édifices parlementaires et salles de réunion publiques,8
45216120,Travaux de construction de bâtiments destinés aux services de secours,8
45216121,Travaux de construction de centres de secours des sapeurs-pompiers,8
45216122,Travaux de construction de centres ambulanciers,8
45216123,Travaux de construction de postes de secours en montagne,8
45216124,Travaux de construction de postes de secours en mer,8
45216125,Travaux de construction de bâtiments des services de secours,8
45216126,Travaux de construction de postes de garde-côtes,8
45216127,Travaux de construction de postes de secours et de sauvetage,8
45216128,Travaux de construction de phares,8
45216129,Abris de protection,8
45216200,Travaux de construction de bâtiments et d'installations militaires,8
45216220,Travaux de construction de bunkers militaires,8
45216230,Travaux de construction d'abris militaires,8
45216250,Travaux de construction de défenses en tranchée,8
45221100,Travaux de construction de ponts,8
45221110,Travaux de construction de ponts,8
45221111,Travaux de construction de ponts routiers,8
45221112,Travaux de construction de ponts de chemin de fer,8
45221113,Travaux de construction de passerelles pour piétons,8
45221114,Travaux de construction de ponts en fer,8
45221115,Travaux de construction de ponts en acier,8
45221117,Travaux de construction de ponts à bascule,8
45221118,Travaux de construction de ponts pour conduites,8
45221119,Travaux de rénovation de ponts,8
45221120,Travaux de construction de viaducs,8
45221121,Travaux de construction de viaducs routiers,8
45221122,Travaux de construction de viaducs ferroviaires,8
45221200,"Travaux de construction de tunnels, de puits et de passages souterrains",8
45221210,Excavations couvertes ou partiellement couvertes,8
45221211,Passage inférieur,8
45221213,Excavations ferroviaires couvertes ou partiellement couvertes,8
45221214,Excavations routières couvertes ou partiellement couvertes,8
45221220,Ponceaux,8
45221230,Puits,8
45221240,Travaux de construction de tunnels,8
45221241,Travaux de construction de tunnels routiers,8
45221242,Travaux de construction de tunnels ferroviaires,8
45221243,Travaux de construction de tunnels pour piétons,8
45221244,Travaux de construction de tunnels pour canal,8
45221245,Travaux de construction de tunnels sous-fluviaux,8
45221246,Travaux de construction de tunnels sous-marins,8
45221247,Percement de tunnels,8
45221248,Travaux de construction de revêtements de tunnels,8
45221250,"Ouvrages souterrains autres que tunnels, puits et passages souterrains",8
45222100,Travaux de construction d'usines de traitement des déchets,8
45222110,Travaux de construction de décharges,8
45222200,Travaux de génie militaire,8
45222300,Travaux de génie pour installations de sécurité,8
45223100,Assemblage de structures en métal,8
45223110,Installation de structures en métal,8
45223200,Ossatures,8
45223210,Ossatures métalliques,8
45223220,Travaux de gros œuvre,8
45223300,Travaux de construction de parkings,8
45223310,Travaux de construction de parkings souterrains,8
45223320,Travaux de construction de parkings de dissuasion,8
45223400,Travaux de construction de stations radar,8
45223500,Structures en béton armé,8
45223600,Travaux de construction de chenils,8
45223700,Travaux de construction d'aires de service,8
45223710,Travaux de construction d'aires de service d'autoroute,8
45223720,Travaux de construction de stations-services,8
45223800,Assemblage et montage de structures préfabriquées,8
45223810,Constructions préfabriquées,8
45223820,Éléments et composants préfabriqués,8
45223821,Éléments préfabriqués,8
45223822,Composants préfabriqués,8
45231100,Travaux généraux de construction pour pipelines,8
45231110,Travaux de pose de conduites,8
45231111,Travaux de démontage et de remplacement de pipelines,8
45231112,Installation de réseau de conduites,8
45231113,Travaux de remplacement de pipelines,8
45231200,Travaux de construction d'oléoducs et de gazoducs,8
45231210,Travaux de construction d'oléoducs,8
45231220,Travaux de construction de gazoducs,8
45231221,Travaux de construction de canalisations d'alimentation en gaz,8
45231222,Gazomètres,8
45231223,Ouvrages annexes pour la distribution de gaz,8
45231300,Travaux de construction de conduites d'eau et de canalisations d'eaux usées à grande distance,8
45231400,Travaux de construction de lignes électriques,8
45231500,Travaux de canalisations d'air comprimé,8
45231510,Travaux relatifs à des circuits pneumatiques de distribution de courrier,8
45231600,Travaux de construction de lignes de communications,8
45232100,Ouvrages annexes pour canalisations d'eau,8
45232120,Travaux d'irrigation,8
45232121,Travaux de construction de canalisations d'irrigation,8
45232130,Travaux de construction de canalisations d'eaux pluviales,8
45232140,Travaux de construction de réseaux de chauffage urbain,8
45232141,Installations de chauffage,8
45232142,Travaux de construction de stations de transfert thermique,8
45232150,Travaux relatifs aux conduites d'alimentation en eau,8
45232151,Travaux de remise à neuf de conduites d'eau,8
45232152,Travaux de construction de stations de pompage,8
45232153,Travaux de construction de châteaux d'eau,8
45232154,Travaux de construction de châteaux d'eau pour l'eau potable,8
45232200,Ouvrages annexes pour lignes électriques,8
45232210,Construction de lignes aériennes,8
45232220,Travaux de construction de sous-stations,8
45232221,Sous-station de transformation,8
45232300,Travaux de construction de lignes téléphoniques et de lignes de communications et ouvrages annexes,8
45232310,Travaux de construction de lignes téléphoniques,8
45232311,Lignes téléphoniques pour bornes d'appel d'urgence,8
45232320,Lignes de télédistribution par câble,8
45232330,Montage d'antennes,8
45232331,Ouvrages annexes de télédiffusion,8
45232332,Ouvrages annexes de télécommunications,8
45232340,Travaux de construction de stations de base de téléphonie mobile,8
45232400,Travaux de construction d'égouts,8
45232410,Travaux d'assainissement,8
45232411,Travaux de construction de canalisations d'eaux usées,8
45232420,Travaux de construction de stations d'épuration des eaux usées,8
45232421,Station de traitement des eaux usées,8
45232422,Station de traitement des boues,8
45232423,Travaux de construction de stations de pompage des eaux usées,8
45232424,Travaux de construction d'émissaires,8
45232430,Travaux de traitement de l'eau,8
45232431,Station de pompage des eaux résiduaires,8
45232440,Travaux de construction de conduites d'eaux d'égouts,8
45232450,Travaux de construction pour système de drainage,8
45232451,Travaux de drainage et travaux de surface,8
45232452,Ouvrages de drainage,8
45232453,Travaux de construction de tuyaux de drainage,8
45232454,Travaux de construction de bassins d'eaux pluviales,8
45232460,Travaux d'installations sanitaires,8
45232470,Station de transfert des déchets,8
45233100,"Travaux de construction d'autoroutes, de routes",8
45233110,Travaux de construction d'autoroutes,8
45233120,Travaux de construction de routes,8
45233121,Travaux de construction de routes principales,8
45233122,Travaux de construction de rocades,8
45233123,Travaux de construction de routes secondaires,8
45233124,Travaux de construction d'artères de grande circulation,8
45233125,Travaux de construction d'intersections de routes,8
45233126,Travaux de construction de carrefours dénivelés,8
45233127,Travaux de construction de carrefours en T,8
45233128,Travaux de construction de carrefours giratoires,8
45233129,Travaux de construction de routes transversales,8
45233130,Travaux de construction de routes nationales,8
45233131,Travaux de construction d'autoroutes aériennes,8
45233139,Entretien des routes nationales,8
45233140,Travaux routiers,8
45233141,Travaux d'entretien routier,8
45233142,Travaux de réparation de routes,8
45233144,Travaux de construction de passages supérieurs,8
45233150,Ouvrages de modération du trafic,8
45233160,Chemins et autres aires empierrées,8
45233161,Travaux de construction de chemins piétonniers,8
45233162,Travaux de construction de pistes cyclables,8
45233200,Travaux de revêtement divers,8
45233210,Travaux de revêtement d'autoroutes,8
45233220,Travaux de revêtement de routes,8
45233221,Travaux de marquage routier,8
45233222,Travaux de pavage et de resurfaçage de chaussées,8
45233223,Travaux de resurfaçage de chaussées,8
45233224,Travaux de construction de routes à deux chaussées séparées,8
45233225,Travaux de construction de routes à chaussée unique,8
45233226,Travaux de construction de routes d'accès,8
45233227,Travaux de construction de bretelles,8
45233228,Travaux de construction de revêtements de surface,8
45233229,Entretien des accotements,8
45233250,"Travaux de revêtements, excepté revêtements de chaussées",8
45233251,Travaux de resurfaçage,8
45233252,Travaux de revêtement de rues,8
45233253,Travaux de revêtement de chemins piétonniers,8
45233260,Travaux de construction de voies piétonnes,8
45233261,Travaux de construction de passages supérieurs pour piétons,8
45233262,Travaux de construction de zones piétonnes,8
45233270,Travaux de marquage d'emplacements de parking,8
45233280,Pose de barrières routières,8
45233290,Installation de panneaux de signalisation,8
45233291,Installation de bollards,8
45233292,Installation de dispositifs de sécurité,8
45233293,Installation de mobilier urbain,8
45233294,Installation de signalisation routière,8
45233300,"Travaux de fondation d'autoroutes, de routes, de rues et de chemins piétonniers",8
45233310,Travaux de fondation d'autoroutes,8
45233320,Travaux de fondation de routes,8
45233330,Travaux de fondation de rues,8
45233340,Travaux de fondation de chemins piétonniers,8
45234100,Ouvrages ferroviaires,8
45234110,Chemin de fer interurbain,8
45234111,Travaux de construction de chemins de fer urbain,8
45234112,Travaux de construction de dépôts ferroviaires,8
45234113,Démolition de voies ferrées,8
45234114,Travaux de construction de remblais de chemin de fer,8
45234115,Travaux de signalisation ferroviaire,8
45234116,Travaux de construction de voies,8
45234120,Ouvrages ferroviaires urbains,8
45234121,Ouvrages pour le tramway,8
45234122,Ouvrages pour le métro,8
45234123,Chemin de fer partiellement souterrain,8
45234124,Transport ferroviaire souterrain de passagers,8
45234125,Station de métro,8
45234126,Travaux de construction de lignes de tramway,8
45234127,Travaux de construction de dépôts de tramway,8
45234128,Travaux de construction d'arrêts de tramway,8
45234129,Travaux de construction de voies ferrées urbaines,8
45234130,Travaux de construction de ballasts,8
45234140,Travaux de construction des passages à niveau,8
45234160,Travaux de construction de caténaires,8
45234170,Travaux de construction de sous-stations électriques à usage ferroviaire,8
45234180,Travaux de construction d'ateliers de chemin de fer,8
45234181,Travaux de construction de postes de sectionnement,8
45234200,Systèmes de transport par câble,8
45234210,Systèmes de transport par câble avec cabines,8
45234220,Travaux de construction de remonte-pente,8
45234230,Travaux de construction de télésièges,8
45234240,Funiculaire,8
45234250,Travaux de construction de téléphériques,8
45235100,Travaux de construction d'aéroports,8
45235110,Travaux de construction de terrains d'aviation,8
45235111,Travaux de revêtement de terrains d'aviation,8
45235200,Travaux de construction de pistes d'envol et d'atterrissage,8
45235210,Resurfaçage de pistes d'envol et d'atterrissage,8
45235300,Travaux de construction d'aires de manœuvre pour avions,8
45235310,Travaux de construction de pistes de roulement,8
45235311,Travaux de revêtement de pistes de roulement,8
45235320,Travaux de construction d'aires de stationnement pour avions,8
45236100,Travaux de nivelage pour équipements sportifs divers,8
45236110,Travaux de nivelage de terrains de sports,8
45236111,Travaux de nivelage de terrains de golf,8
45236112,Travaux de nivelage de courts de tennis,8
45236113,Travaux de nivelage de champs de courses,8
45236114,Travaux de nivelage de pistes,8
45236119,Travaux de réparation de terrains de sports,8
45236200,Travaux de nivelage d'installations récréatives,8
45236210,Travaux de nivelage d'aires de jeu pour enfants,8
45236220,Travaux de nivelage de zoos,8
45236230,Travaux de nivelage de jardins,8
45236250,Travaux de nivelage de parcs,8
45236290,Travaux de réparation d'espaces de loisir,8
45236300,Travaux de nivelage pour cimetières,8
45241100,Travaux de construction de quais,8
45241200,Travaux de construction in situ de terminaux offshore,8
45241300,Travaux de construction de jetées,8
45241400,Travaux de construction de docks,8
45241500,Travaux de construction de môles,8
45241600,Installation de matériel d'éclairage portuaire,8
45242100,Travaux de construction d'installations de sports nautiques,8
45242110,Travaux de construction de voies de mise à l'eau,8
45242200,Travaux de construction de marinas,8
45242210,Travaux de construction de ports de plaisance,8
45243100,Ouvrages de protection des falaises,8
45243110,Travaux de stabilisation des falaises,8
45243200,Travaux de construction de brise-lames,8
45243300,Travaux de construction de digues de mer,8
45243400,Travaux de consolidation des plages,8
45243500,Travaux de construction d'ouvrages de défense maritimes,8
45243510,Travaux d'endiguement,8
45243600,Travaux de construction de murs de quai,8
45244100,Installations maritimes,8
45244200,Jetées,8
45246100,Construction de murs de rive,8
45246200,Travaux de protection des berges,8
45246400,Ouvrages de protection contre les inondations,8
45246410,Entretien de digues,8
45246500,Travaux de construction de promenades,8
45246510,Travaux de construction de chemins de planches,8
45247100,Travaux de construction de voies navigables,8
45247110,Construction de canaux,8
45247111,Travaux de construction de canaux d'irrigation,8
45247112,Travaux de construction de canaux de drainage,8
45247120,"Voies navigables, excepté canaux",8
45247130,Travaux de construction d'aqueducs,8
45247200,Travaux de construction de barrages et d'ouvrages fixes similaires,8
45247210,Travaux de construction de barrages,8
45247211,Travaux de construction de murs de barrage,8
45247212,Travaux de renforcement de barrage,8
45247220,Travaux de construction de déversoirs,8
45247230,Travaux de construction de digues,8
45247240,Travaux de construction de barrages statiques,8
45247270,Travaux de construction de réservoirs,8
45248100,Travaux de construction d'écluses de canal,8
45248200,Travaux de construction de cales sèches,8
45248300,Travaux de construction de docks flottants,8
45248400,Travaux de construction d'appontements,8
45248500,Travaux de construction de barrages mobiles,8
45251100,Travaux de construction de centrales électriques,8
45251110,Travaux de construction de centrales nucléaires,8
45251111,Travaux de construction d'un réacteur nucléaire,8
45251120,Travaux de construction de centrales hydroélectriques,8
45251140,Travaux de construction de centrales thermiques,8
45251141,Travaux de construction de centrales géothermiques,8
45251142,Travaux de construction de centrales alimentées au bois,8
45251143,Travaux de construction d'unités de production d'air comprimé,8
45251150,Travaux de construction de tours de refroidissement,8
45251160,Installations à énergie éolienne,8
45251200,Travaux de construction de centrales de chauffage,8
45251220,Travaux de construction de centrales de cogénération,8
45251230,Travaux de construction d'usines génératrices de vapeur,8
45251240,Travaux de construction de centrales de production d'électricité alimentées au gaz de décharge,8
45251250,Travaux de construction de centrales de chauffage urbain,8
45252100,Travaux de construction de stations d'épuration,8
45252110,Travaux de construction de centrales mobiles,8
45252120,Travaux de construction d'installations de traitement des eaux,8
45252121,Installations de sédimentation,8
45252122,Digesteurs de boues,8
45252123,Installations de criblage,8
45252124,Travaux de dragage et de pompage,8
45252125,Travaux d'enrochement,8
45252126,Travaux de construction de stations de traitement de l'eau potable,8
