code,cpv_label,level
03,"Produits agricoles, de l'élevage, de la pêche, de la sylviculture et produits connexes",2
09,"Produits pétroliers, combustibles, électricité et autres sources d'énergie",2
14,"Produits d'exploitation des mines, métaux de base et produits connexes",2
15,"Produits alimentaires, boissons, tabac et produits connexes",2
16,Machines agricoles,2
18,"Vêtements, articles chaussants, bagages et accessoires",2
19,"Produits en cuir et textiles, matériaux en plastique et en caoutchouc",2
22,Imprimés et produits connexes,2
24,Produits chimiques,2
30,"Machines, matériel et fourniture informatique et de bureau, excepté les meubles et logiciels",2
31,"Machines, appareils, équipements et consommables électriques; éclairage",2
32,"Équipements et appareils de radio, de télévision, de communication, de télécommunication et équipements connexes",2
33,"Matériels médicaux, pharmaceutiques et produits de soins personnnels",2
34,Équipement de transport et produits auxiliaires pour le transport,2
35,"Équipement de sécurité, de lutte contre l'incendie, de police et de défense",2
37,"Instruments de musique, articles de sport, jeux, jouets, articles pour artisanat, articles pour travaux artistiques et accessoires",2
38,"Équipements de laboratoire, d'optique et de précision (excepté les lunettes)",2
39,"Meubles (y compris les meubles de bureau), aménagements, appareils électroménagers (à l'exclusion de l'éclairage) et produits de nettoyage",2
41,Eau collectée et purifiée,2
42,Machines industrielles,2
43,"Équipement minier, équipement pour l'exploitation de carrières, matériel de construction",2
44,Matériaux et structures de construction; produits auxiliaires pour la construction (à l'exception des appareils électriques),2
45,Travaux de construction,2
48,Logiciels et systèmes d'information,2
50,Services de réparation et d'entretien,2
51,Services d'installation (à l'exception des logiciels),2
55,"Services d'hôtellerie, de restauration et de commerce au détail",2
60,Services de transport (à l'exclusion du transport des déchets),2
63,"Services d'appui et services auxiliaires dans le domaine des transports, services des agences de voyages",2
64,Services des postes et télécommunications,2
65,Services publics,2
66,Services financiers et d'assurance,2
70,Services immobiliers,2
71,"Services d'architecture, services de construction, services d'ingénierie et services d'inspection",2
72,"Services de technologies de l'information, conseil, développement de logiciels, internet et appui",2
73,Services de recherche et développement et services de conseil connexes,2
75,"Services de l'administration publique, de la défense et de la sécurité sociale",2
76,Services relatifs à l'industrie du pétrole et du gaz,2
77,"Services agricoles, sylvicoles, horticoles, d'aquaculture et d'apiculture",2
79,"Services aux entreprises: droit, marketing, conseil, recrutement, impression et sécurité",2
80,Services d'enseignement et de formation,2
85,Services de santé et services sociaux,2
90,"Services d'évacuation des eaux usées et d'élimination des déchets, services d'hygiénisation et services relatifs à l'environnement",2
92,"Services récréatifs, culturels et sportifs",2
98,"Autres services communautaires, sociaux et personnels",2
031,Produits agricoles et produits de l'horticulture,3
032,"Céréales, pommes de terre, légumes, fruits et noix",3
033,"Produits agricoles, de la chasse et de la pêche",3
034,Produits de la sylviculture et de l'exploitation forestière,3
091,Combustibles,3
092,"Produits pétroliers, charbon et huiles",3
093,"Électricité, chauffage, énergie solaire et nucléaire",3
142,Sable et argile,3
143,Produits inorganiques chimiques et engrais minéraux,3
144,Sel et chlorure de sodium pur,3
145,Produits connexes d'exploitation de mines et de carrières,3
146,Minerais de métaux et alliages,3
147,Métaux de base,3
148,Produits minéraux non métalliques divers,3
149,Matières premières de récupération,3
151,"Produits de l'élevage, viande et produits à base de viande",3
152,Poisson préparé et conserves de poisson,3
153,"Fruits, légumes et produits connexes",3
154,Huiles et graisses animales ou végétales,3
155,Produits laitiers,3
156,"Produits de la minoterie, amidon et produits amylacés",3
157,Aliments pour animaux,3
158,Produits alimentaires divers,3
159,"Boissons, tabac et produits connexes",3
161,Machines agricoles et sylvicoles pour la préparation ou la culture des sols,3
163,Moissonneuses,3
164,Machines de pulvérisation à usage agricole ou horticole,3
165,Remorques et semi-remorques autochargeuses ou déchargeuses à usage agricole,3
166,Machines spécialisées à usage agricole ou sylvicole,3
167,Tracteurs,3
168,Pièces pour machines agricoles et sylvicoles,3
181,"Vêtements professionnels, vêtements de travail spéciaux et accessoires",3
182,Vêtements d'extérieur,3
183,Articles d'habillement,3
184,Vêtements spéciaux et accessoires,3
185,"Bijouterie, montres et articles connexes",3
186,Fourrure et articles en fourrure,3
188,Articles chaussants,3
189,"Bagages, sellerie, sacs et sachets",3
191,Cuir,3
192,Textiles et articles connexes,3
194,Fil textile,3
195,Produits en caoutchouc et en plastique,3
196,"Déchets de cuir, déchets textiles, déchets de caoutchouc et déchets de plastique",3
197,Caoutchouc et fibres synthétiques,3
221,"Livres, brochures et dépliants imprimés",3
222,"Journaux, revues spécialisées, périodiques et magazines",3
223,"Cartes postales, cartes de vœux et autres imprimés",3
224,"Timbres, formules de chèque, billets de banque, actions, publicité professionnelle, catalogues et manuels",3
225,"Plaques ou cylindres d'impression, autre matériel d'imprimerie",3
226,Encre,3
228,"Registres, livres comptables, classeurs, formulaires et autres articles de papeterie imprimés en papier ou en carton",3
229,Imprimés divers,3
241,Gaz,3
242,Colorants et pigments,3
243,Produits chimiques organiques et inorganiques de base,3
244,Engrais et composés azotés,3
245,Matières plastiques sous forme primaire,3
246,Explosifs,3
249,Produits de chimie fine et produits de chimie variés,3
301,"Machines, matériel et fournitures de bureau, excepté ordinateurs, imprimantes et meubles",3
302,Matériel et fournitures informatiques,3
311,"Moteurs, générateurs et transformateurs électriques",3
312,Appareils de distribution et de commande électriques,3
313,Fils et câbles isolés,3
314,"Accumulateurs, piles et batteries primaires",3
315,Appareils d'éclairage et lampes électriques,3
316,Matériel électrique,3
317,"Fournitures électroniques, électromécaniques et électrotechniques",3
322,"Appareils émetteurs de radiotéléphonie, de radiotélégraphie, de radiodiffusion et de télévision",3
323,Récepteurs de télévision et de radio et appareils d'enregistrement ou de reproduction du son ou de l'image,3
324,Réseaux,3
325,Matériel de télécommunications,3
331,Équipements médicaux,3
336,Produits pharmaceutiques,3
337,Produits de soins personnels,3
339,Équipement et fournitures pour autopsie et à usage mortuaire,3
341,Véhicules à moteur,3
342,"Carrosseries, remorques ou semi-remorques de véhicules",3
343,Pièces détachées et accessoires pour véhicules et moteurs de véhicules,3
344,"Motos, bicyclettes et side-cars",3
345,Navires et bateaux,3
346,Locomotives et matériel roulant de chemin de fer et de tramway et pièces détachées,3
347,Aéronefs et spationefs,3
349,Équipement de transport et pièces détachées divers,3
351,Matériel de secours et de sécurité,3
352,Équipement de police,3
353,"Armes, munitions et pièces associées",3
354,Véhicules militaires et pièces connexes,3
355,Navires de guerre et pièces connexes,3
356,"Avions, missiles et spationefs militaires",3
357,Systèmes électroniques militaires,3
358,Équipement individuel et de soutien,3
373,Instruments de musique et pièces pour instruments de musique,3
374,Articles et équipements de sport,3
375,Jeux et jouets; attractions foraines,3
378,Fournitures pour travaux d'artisanat et travaux artistiques,3
381,Instruments de navigation et de météorologie,3
382,Instruments géologiques et géophysiques,3
383,Instruments de mesure,3
384,Instruments de contrôle de propriétés physiques,3
385,Appareils de contrôle et d'essai,3
386,Instruments d'optique,3
387,Horloges de pointage et compteurs similaires; parcmètres,3
388,Équipement de commande des processus industriels et matériel de télécommande,3
389,Instruments divers d'évaluation ou de test,3
391,Mobilier,3
392,Aménagements,3
393,Équipement divers,3
395,Articles textiles,3
397,Appareils ménagers,3
398,Produits de nettoyage et produits à polir,3
411,Eau brute,3
421,Machines de production et d'utilisation de la puissance mécanique,3
422,"Machines utilisées pour le traitement des aliments, des boissons et du tabac et pièces accessoires",3
423,"Fourneaux, incinérateurs et fours industriels ou de laboratoire",3
424,Matériel de levage et de manutention et pièces détachées,3
425,Matériel de réfrigération et de ventilation,3
426,Machines-outils,3
427,"Machines pour l'industrie du textile, de l'habillement et du cuir",3
428,Machines de fabrication du papier ou du carton,3
429,Machines diverses à usage général et à usage spécial,3
431,Équipement minier,3
432,Machines de terrassement et d'excavation et pièces détachées,3
433,Machines et équipement pour la construction,3
434,Machines de traitement des minéraux et de formage des moules de fonderie,3
435,Véhicules à chenilles,3
436,Pièces pour machines pour les industries excavatrices et la construction,3
437,Machines de métallurgie et pièces associées,3
438,Équipement d'atelier,3
441,Matériaux de construction et articles connexes,3
442,Produits structurels,3
443,"Câble, fil métallique et produits connexes",3
444,Produits fabriqués divers et éléments connexes,3
445,"Outils, serrures, clés, charnières, fermoirs, chaînes et ressorts",3
446,"Citernes, réservoirs, conteneurs; radiateurs et chaudières de chauffage central",3
448,"Peintures, vernis et mastics",3
449,"Pierre de construction, chaux, gypse et ardoise",3
451,Travaux de préparation de chantier,3
452,Travaux de construction complète ou partielle et travaux de génie civil,3
453,Travaux d'équipement du bâtiment,3
454,Travaux de parachèvement de bâtiment,3
455,Location de machines et de matériel de construction et de génie civil avec opérateur,3
481,Logiciels pour l'industrie,3
482,Logiciels de réseau d'internet et d'intranet,3
483,"Logiciels de création de documents, de dessin, de synthèse d'images, de planification et de productivité",3
484,Logiciels de transactions commerciales et de transactions personnelles,3
485,Logiciels de communications et multimédias,3
486,Logiciels de bases de données et d'exploitation,3
487,Logiciels utilitaires,3
488,Systèmes d'information et serveurs,3
489,Logiciels et systèmes informatiques divers,3
501,Services de réparation et d'entretien de véhicules et d'équipements associés et services connexes,3
502,"Services de réparation, d'entretien et services connexes relatifs au matériel de transport aérien, ferroviaire, routier et maritime",3
503,"Services de réparation, d'entretien et services connexes relatifs aux ordinateurs personnels, au matériel de bureau, au matériel de télécommunications et au matériel audiovisuel",3
504,Services de réparation et d'entretien de matériel médical et de matériel de précision,3
505,"Services de réparation et d'entretien de pompes, de vannes, de robinets, de conteneurs en métal et de machines",3
506,Services de réparation et d'entretien des matériels de défense et de sécurité,3
507,Services de réparation et d'entretien d'installations de bâtiments,3
508,Services divers d'entretien et de réparation,3
511,Services d'installation de matériel électrique et mécanique,3
512,"Services d'installation de matériel de mesure, de contrôle, d'essai et de navigation",3
513,Services d'installation de matériel de communications,3
514,Services d'installation de matériel médical et chirurgical,3
515,Services d'installation de machines et d'équipements,3
516,Services d'installation d'ordinateurs et de matériel de bureau,3
517,Services d'installation de matériel de protection contre l'incendie,3
518,Services d'installation de conteneurs en métal,3
519,Services d'installation de systèmes de guidage et de commande,3
551,Services d'hôtellerie,3
552,Campings et autre hébergement non hôtelier,3
553,Services de restaurant et services de personnel en salle,3
554,Services de débits de boissons,3
555,Services de cantine et service traiteur,3
559,Services de vente au détail,3
601,Services de transport routier,3
602,Services de transport ferroviaire,3
603,Services de transport par pipeline,3
604,Services de transport aérien,3
605,Services de transport spatial,3
606,Services de transport par voie d'eau,3
631,Services de manutention et d'entreposage de cargaisons,3
635,"Services d'agences de voyages, de voyagistes et d'assistance aux touristes",3
637,"Services d'appui dans le domaine des transports terrestres, maritimes et aériens",3
641,Services postaux et services de courrier,3
642,Services de télécommunications,3
651,Distribution d'eau et services connexes,3
652,Distribution de gaz et services connexes,3
653,Distribution d'électricité et services connexes,3
654,Autres sources d'approvisionnement en énergie et leur distribution,3
655,Services de lecture de compteurs,3
661,Services bancaires et d'investissement,3
665,Services d'assurance et services de retraite,3
666,Services de trésorerie,3
667,Services de réassurance,3
701,Services immobiliers propres,3
702,Services de crédit-bail ou de location de biens immobiliers propres,3
703,Services d'agence immobilière prestés pour le compte de tiers,3
712,Services d'architecture,3
713,Services d'ingénierie,3
714,Services d'urbanisme et d'architecture paysagère,3
715,Services relatifs à la construction,3
716,"Services d'essais techniques, services d'analyses et services de conseil",3
717,Services de surveillance et de contrôle,3
718,Services de conseil en matière d'approvisionnement en eau et services de conseil en matière de déchets,3
719,Services de laboratoire,3
721,Services de conseil en matériel informatique,3
722,Services de programmation et de conseil en logiciels,3
723,Services de commutation de données,3
724,Services internet,3
725,Services informatiques,3
726,Services d'assistance et de conseils informatiques,3
727,Services de réseaux informatiques,3
728,Services d'audit informatique et services d'essai informatique,3
729,Services de secours informatique et services informatiques de conversion de catalogues,3
731,Services de recherche et développement expérimental,3
732,Services de conseil en recherche et développement,3
733,Conception et exécution dans le domaine de la recherche et du développement,3
734,Services de recherche et développement en matière de matériels de sécurité et de défense,3
751,Services de l'administration publique,3
752,Prestations de services pour la collectivité,3
753,Services de sécurité sociale obligatoire,3
761,Services professionnels relatifs à l'industrie du gaz,3
762,Services professionnels relatifs à l'industrie pétrolière,3
763,Services de forage,3
764,Services de positionnement d'appareils de forage,3
765,Services onshore et offshore,3
766,Services de contrôle de pipelines,3
771,Services agricoles,3
772,Services sylvicoles,3
773,Services horticoles,3
774,Services zoologiques,3
775,Services d'élevage,3
776,Services liés à la chasse,3
777,Services liés à la pêche,3
778,Services liés à l'aquaculture,3
779,Services liés à l'apiculture,3
791,Services juridiques,3
792,"Services de comptabilité, services d'audit et services fiscaux",3
793,Études de marché et recherche économique; sondages et statistiques,3
794,Conseil en affaires et en gestion et services connexes,3
795,Services d'appui bureautiques,3
796,Services de recrutement,3
797,Services d'enquête et de sécurité,3
798,Services d'impression et services connexes,3
799,Services divers aux entreprises et services connexes,3
801,Services d'enseignement primaire,3
802,Services d'enseignement secondaire,3
803,Services d'enseignement supérieur,3
804,Services d'éducation des adultes et autres services d'enseignement,3
805,Services de formation,3
806,Services de formation dans le domaine des équipements militaires et de sécurité,3
851,Services de santé,3
852,Services vétérinaires,3
853,Services d'action sociale et services connexes,3
904,Services des eaux usées,3
905,Services liés aux déchets et aux ordures,3
906,"Services de propreté et d'hygiénisation en milieu urbain ou rural, et services connexes",3
907,Services relatifs à l'environnement,3
909,Services de nettoyage et d'hygiène,3
921,Services cinématographiques et services vidéo,3
922,Services de radio et de télévision,3
923,Services de divertissement,3
924,Services d'agences de presse,3
925,"Services de bibliothèques, archives, musées et autres services culturels",3
926,Services sportifs,3
927,Services de cybercafé,3
981,Services des organisations associatives,3
982,Services de conseil en matière d'égalité des chances,3
983,Services divers,3
985,Ménages privés employant du personnel,3
989,Services prestés par des organisations et des organismes extra-territoriaux,3
0311,"Produits agricoles, produits de la culture maraîchère et de l'horticulture commerciale",4
0312,Produits horticoles et produits de pépinières,4
0313,Plantes pour boissons et épices,4
0314,Produits animaux et produits connexes,4
0321,Céréales et pommes de terre,4
0322,"Légumes, fruits et noix",4
0331,"Poissons, crustacés et produits aquatiques",4
0332,"Bétail, cheptel et petits animaux",4
0333,Produits des animaux d'élévage,4
0334,Marques auriculaires pour animaux,4
0341,Bois,4
0342,Gommes,4
0343,Liège,4
0344,Produits de la sylviculture,4
0345,Produits de pépinière,4
0346,Pâte à papier,4
0911,Combustibles solides,4
0912,Combustibles gazeux,4
0913,Pétrole et distillats,4
0921,Préparations lubrifiantes,4
0922,"Vaseline, cires de pétrole et essences spéciales",4
0923,Pétrole (brut),4
0924,Huile et produits dérivés du charbon,4
0931,Électricité,4
0932,"Vapeur, eau chaude et produits connexes",4
0933,Énergie solaire,4
0934,Combustibles nucléaires,4
1421,"Gravier, sable, pierre concassée et agrégats",4
1422,Argile et kaolin,4
1431,Engrais minéraux,4
1432,Produits inorganiques chimiques,4
1441,Sel gemme,4
1442,Sel marin,4
1443,Sel concentré par évaporation et chlorure de sodium pur,4
1445,Saumure,4
1452,"Pierres précieuses et semi-précieuses, pierre ponce, émeri, abrasifs naturels, autres minéraux et métaux précieux",4
1461,Minerais de métaux,4
1462,Alliages,4
1463,"Scories, laitier, déchets et débris ferreux",4
1471,"Fer, plomb, zinc, étain et cuivre",4
1472,"Aluminium, nickel, scandium, titane et vanadium",4
1473,"Chrome, manganèse, cobalt, yttrium et zirconium",4
1474,"Molybdène, technétium, ruthénium et rhodium",4
1475,"Cadmium, lutétium, hafnium, tantale et tungstène",4
1476,"Iridium, gallium, indium, thallium et barium",4
1477,"Césium, strontium, rubidium et calcium",4
1478,"Potassium, magnésium, sodium et lithium",4
1479,"Niobium, osmium, rhénium et palladium",4
1481,Produits abrasifs,4
1482,Verre,4
1483,Fibres de verre,4
1491,Matières premières métalliques de récupération,4
1492,Matières premières non métalliques de récupération,4
1493,Cendres et résidus contenant des métaux,4
1511,Viande,4
1513,Produits à base de viande,4
1521,"Filets de poisson, foie et œufs ou laitance de poisson",4
1522,"Poisson, filets de poisson et autre chair de poisson congelés",4
1523,Poisson séché ou salé; poisson en saumure; poisson fumé,4
1524,Poisson en conserve ou en boîte et autres poissons préparés ou en conserve,4
1525,Fruits de mer,4
1531,Pommes de terre et produits à base de pomme de terre,4
1532,Jus de fruits et de légumes,4
1533,Fruits et légumes transformés,4
1541,Huiles et graisses animales ou végétales brutes,4
1542,Huiles et graisses raffinées,4
1543,Graisses comestibles,4
1551,Lait et crème fraîche,4
1553,Beurre,4
1554,Fromages,4
1555,Produits laitiers divers,4
1561,Produits de la minoterie,4
1562,Amidons et produits amylacés,4
1571,Aliments prêts à l'emploi pour animaux d'élevage et autres animaux,4
1581,"Produits de panification, pâtisserie fraîche et gâteaux",4
1582,Biscottes et biscuits; pâtisserie et gâteaux de conservation,4
1583,Sucre et produits connexes,4
1584,Cacao; chocolat et sucreries,4
1585,Pâtes alimentaires,4
1586,"Café, thé et produits connexes",4
1587,Condiments et assaisonnements,4
1588,Produits nutritionnels spéciaux,4
1589,Produits alimentaires et produits secs divers,4
1591,Boissons alcoolisées distillées,4
1593,Vins,4
1594,Cidre et autres vins à base de fruits,4
1595,Boissons fermentées non distillées,4
1596,Bière de malt,4
1598,Boissons sans alcool,4
1599,"Tabac, produits à base de tabac et articles connexes",4
1611,Charrues ou herses à disques,4
1612,"Herses, scarificateurs, cultivateurs, sarcleuses ou houes",4
1613,"Semoirs, plantoirs ou repiqueurs",4
1614,Épandeurs de fumier,4
1615,Rouleaux pour pelouses ou terrains de sports,4
1616,Matériel de jardinage divers,4
1631,Faucheuses,4
1632,Machines de fenaison,4
1633,Presses à paille ou à fourrage,4
1634,Moissonneuses-batteuses,4
1651,Remorques autochargeuses à usage agricole,4
1652,Remorques déchargeuses à usage agricole,4
1653,Semi-remorques autochargeuses à usage agricole,4
1654,Semi-remorques déchargeuses à usage agricole,4
1661,"Machines de nettoyage, de tri ou de calibrage d'œufs, de fruits ou d'autres produits",4
1662,Trayeuses,4
1663,Machines de préparation d'aliments pour animaux,4
1664,Machines apicoles,4
1665,Machines avicoles,4
1671,Tracteurs agricoles à conducteur accompagnant,4
1672,Tracteurs d'occasion,4
1673,Moteurs de traction,4
1681,Pièces pour machines agricoles,4
1682,Pièces pour machines sylvicoles,4
1811,Vêtements professionnels,4
1813,Vêtements de travail spéciaux,4
1814,Accessoires pour vêtements de travail,4
1821,Manteaux,4
1822,Vêtements de protection contre les intempéries,4
1823,Vêtements d'extérieur divers,4
1831,Sous-vêtements,4
1832,"Soutiens-gorge, corsets, jarretelles et articles similaires",4
1833,T-shirts et chemises,4
1841,Vêtements spéciaux,4
1842,Accessoires d'habillement,4
1844,Chapeaux et coiffures,4
1845,Fermetures (vêtements),4
1851,Bijouterie et articles connexes,4
1852,Horlogerie personnelle,4
1853,Cadeaux et prix,4
1861,Articles en fourrure,4
1862,Fourrures,4
1881,Chaussures autres que les chaussures de sport ou de protection,4
1882,Chaussures de sport,4
1883,Chaussures de protection,4
1884,Parties de chaussures,4
1891,Sellerie,4
1892,Bagages,4
1893,Sacs et sachets,4
1911,Peau de chamois,4
1912,Cuir de bovidé ou d'équidé,4
1913,"Cuir d'ovin, de caprin ou de porcin",4
1914,"Cuir d'autres animaux, cuir reconstitué et autres cuirs",4
1916,Bracelets de montre,4
1917,Articles en cuir utilisés dans les machines ou les appareils mécaniques,4
1921,Tissus,4
1922,Tissu cardé,4
1923,Tissu de lin,4
1924,Tissu spécial,4
1925,Tissu tricoté ou crocheté,4
1926,Étoffe,4
1927,Tissu non-tissé,4
1928,"Laine, cuirs et peaux",4
1941,Fibres textiles naturelles,4
1942,Fibres textiles artificielles,4
1943,Fil textile en fibres naturelles,4
1944,Fil ou filé synthétique,4
1951,Produits en caoutchouc,4
1952,Produits en plastique,4
1961,Déchets de cuir,4
1962,Déchets textiles,4
1963,Déchets de caoutchouc,4
1964,Sacs et sachets à ordures en polyéthylène,4
1971,Caoutchouc synthétique,4
1972,Fibres synthétiques,4
1973,Fibres artificielles,4
2211,Livres imprimés,4
2212,Publications,4
2213,Annuaires,4
2214,Dépliants,4
2215,Brochures,4
2216,Fascicules,4
2221,Journaux,4
2231,Cartes postales,4
2232,Cartes de vœux,4
2241,Timbres,4
2242,Papier timbré,4
2243,Billets de banque,4
2244,Formules de chèque,4
2245,Imprimés infalsifiables,4
2246,"Publicité professionnelle, catalogues commerciaux et manuels",4
2247,Manuels,4
2251,Plaques offset,4
2252,Matériel de gravure sèche,4
2261,Encre d'imprimerie,4
2281,Registres en papier ou en carton,4
2282,Formulaires,4
2283,Cahiers d'exercices,4
2284,Albums pour échantillons,4
2285,Classeurs et accessoires pour classeurs,4
2299,"Papiers à usage graphique, ni couchés ni enduits",4
2411,Gaz industriels,4
2421,"Oxydes, peroxydes et hydroxydes",4
2422,"Extraits tannants, extraits tinctoriaux, tannins et matières colorantes",4
2431,Produits chimiques inorganiques de base,4
2432,Produits chimiques organiques de base,4
2441,Engrais azotés,4
2442,Engrais phosphatés,4
2443,Engrais d'origine animale ou végétale,4
2444,Engrais divers,4
2445,Produits agrochimiques,4
2451,Polymères d'éthylène sous forme primaire,4
2452,Polymères de propylène sous forme primaire,4
2453,Polymères de styrène sous forme primaire,4
2454,Polymères de vinyle sous forme primaire,4
2455,Polyesters sous forme primaire,4
2456,Polyamides sous forme primaire,4
2457,Résines uréiques sous forme primaire,4
2458,Résines aminiques sous forme primaire,4
2459,Silicones sous forme primaire,4
2461,Explosifs préparés,4
2491,Colles,4
2492,Huiles essentielles,4
2493,Substances chimiques pour photographie,4
2495,Préparations chimiques spéciales,4
2496,Produits chimiques variés,4
3011,Machines de traitement de texte,4
3012,Photocopieurs et matériel d'impression offset,4
3013,Matériel de bureau de poste,4
3014,Machines à calculer et machines comptables,4
3015,Machines à écrire,4
3016,Cartes magnétiques,4
3017,Étiqueteuses,4
3018,Machines à endosser et à rédiger les chèques,4
3019,"Machines, fournitures et équipement de bureau divers",4
